{
  "schema_version": 1,
  "date": "2026-04-13",
  "generated_at": "2026-04-13T00:00:00+00:00",
  "since": "2026-03-14T00:00:00+00:00",
  "selection": {
    "fetched": 20,
    "deduplicated": 20,
    "out_of_domain": 0,
    "suppressed": 0,
    "below_threshold": 0,
    "published": 20,
    "pinned": 5,
    "minimum_score": 30.0
  },
  "health": [
    {
      "source": "VLM Survey Report",
      "ok": true,
      "item_count": 20,
      "required": false,
      "duration_seconds": 0.0,
      "detail": "Replayed from progressive reports/2026-04-13.md"
    }
  ],
  "items": [
    {
      "source": "VLM Survey Report",
      "source_id": "report/2026-04-13:come-vl-scaling-complementary-multi-encoder-vl-learning:https-arxiv-org-abs-2604-03231",
      "title": "CoME-VL: Scaling Complementary Multi-Encoder VL Learning",
      "url": "https://arxiv.org/abs/2604.03231",
      "event_kind": "curated",
      "provenance": "curated",
      "categories": [
        "post_training",
        "efficiency"
      ],
      "relevance_score": 67.0,
      "evidence_score": 52.0,
      "recency_score": 66.67,
      "adoption_score": 0.0,
      "total_score": 53.57,
      "score_version": 1,
      "published_at": "2026-04-03T00:00:00+00:00",
      "summary": "Key Contribution: Fuses CLIP + DINO encoders via entropy-guided multi-layer aggregation + RoPE cross-attention; +4.9% understanding, +5.4% grounding",
      "organizations": [
        "Community"
      ],
      "facets": {
        "survey_section": "3. Post-Training / Alignment > 3.3 Efficient Training & Quantization",
        "survey_origin": "report/2026-04-13",
        "columns": {
          "Title": "CoME-VL: Scaling Complementary Multi-Encoder VL Learning",
          "Date": "04/03/2026",
          "Key Contribution": "Fuses CLIP + DINO encoders via entropy-guided multi-layer aggregation + RoPE cross-attention; +4.9% understanding, +5.4% grounding"
        },
        "report_date": "2026-04-13"
      },
      "section": "3. Post-Training / Alignment > 3.3 Efficient Training & Quantization",
      "matched_terms": [
        "post training",
        "alignment",
        "quantization"
      ],
      "model_families": [
        "CLIP / SigLIP"
      ],
      "rationale": [
        "Topics: Post-training, Efficiency",
        "Matched: post training, alignment, quantization",
        "Tracked family: CLIP / SigLIP",
        "Primary record: VLM Survey Report"
      ],
      "discovered_at": "2026-04-13T00:00:00+00:00",
      "raw_payload_hash": "sha256:6dd42600f4d974f6eb03786d0cb7bdbf53361ac87a28bc9b98dcdd0bfa7ae58e"
    },
    {
      "source": "VLM Survey Report",
      "source_id": "report/2026-04-13:molmoweb-open-visual-web-agent-and-open-data-for-the-open-web:https-huggingface-tw-papers-2604-08516",
      "title": "MolmoWeb: Open Visual Web Agent and Open Data for the Open Web",
      "url": "https://huggingface.tw/papers/2604.08516",
      "event_kind": "curated",
      "provenance": "curated",
      "categories": [
        "gui_agent"
      ],
      "relevance_score": 35.0,
      "evidence_score": 52.0,
      "recency_score": 90.0,
      "adoption_score": 0.0,
      "total_score": 47.24,
      "score_version": 1,
      "published_at": "2026-04-10T00:00:00+00:00",
      "summary": "Key Contribution: Full paper release (4B/8B); screenshot-only web agent (no HTML/a11y tree needed); SoTA on WebVoyager (94.7% pass@4), Online-Mind2Web (60.5% pass@4); outperforms GPT-4o set-of-marks agents; open checkpoints, data, code",
      "organizations": [
        "OpenAI"
      ],
      "facets": {
        "survey_section": "4. Applications > 4.2 Web Agents",
        "survey_origin": "report/2026-04-13",
        "columns": {
          "Title": "MolmoWeb: Open Visual Web Agent and Open Data for the Open Web",
          "Date": "04/10/2026",
          "Key Contribution": "Full paper release (4B/8B); screenshot-only web agent (no HTML/a11y tree needed); SoTA on WebVoyager (94.7% pass@4), Online-Mind2Web (60.5% pass@4); outperforms GPT-4o set-of-marks agents; open checkpoints, data, code"
        },
        "report_date": "2026-04-13"
      },
      "section": "4. Applications > 4.2 Web Agents",
      "matched_terms": [
        "web agent"
      ],
      "model_families": [
        "GPT-4V / GPT-5"
      ],
      "watchlist": [
        "WebArena / OSWorld"
      ],
      "watchlist_notes": [
        "GUI and web agent evaluation."
      ],
      "rationale": [
        "Topics: GUI & web agents",
        "Matched: web agent",
        "Tracked family: GPT-4V / GPT-5",
        "GUI and web agent evaluation.",
        "Primary record: VLM Survey Report"
      ],
      "discovered_at": "2026-04-13T00:00:00+00:00",
      "raw_payload_hash": "sha256:b629f83475dbecb7408c0ed60274900b1cf221c0971455d7567f0ac1c976719d"
    },
    {
      "source": "VLM Survey Report",
      "source_id": "report/2026-04-13:gemma-4:https-blog-google-innovation-and-ai-technology-developers-to",
      "title": "Gemma 4",
      "url": "https://blog.google/innovation-and-ai/technology/developers-tools/gemma-4/",
      "event_kind": "curated",
      "provenance": "curated",
      "categories": [
        "vlm_model"
      ],
      "relevance_score": 49.0,
      "evidence_score": 52.0,
      "recency_score": 63.33,
      "adoption_score": 0.0,
      "total_score": 45.89,
      "score_version": 1,
      "published_at": "2026-04-02T00:00:00+00:00",
      "summary": "Architecture: Decoder-only / MoE. Training Data: Undisclosed (140+ languages). Parameters: E2B / E4B / 26B MoE (~3.8B active) / 31B Dense. Vision Encoder: Native multimodal (image/video/audio). Pretrained Backbone: Gemini 3",
      "organizations": [
        "Google"
      ],
      "facets": {
        "survey_section": "1. New SoTA VLMs",
        "survey_origin": "report/2026-04-13",
        "columns": {
          "Model": "Gemma 4 (Google)",
          "Date": "04/02/2026",
          "Architecture": "Decoder-only / MoE",
          "Training Data": "Undisclosed (140+ languages)",
          "Parameters": "E2B / E4B / 26B MoE (~3.8B active) / 31B Dense",
          "Vision Encoder": "Native multimodal (image/video/audio)",
          "Pretrained Backbone": "Gemini 3"
        },
        "report_date": "2026-04-13"
      },
      "section": "1. New SoTA VLMs",
      "matched_terms": [
        "vlm",
        "vision encoder",
        "native multimodal"
      ],
      "model_families": [
        "Gemini / Gemma"
      ],
      "rationale": [
        "Topics: VLM releases",
        "Matched: vlm, vision encoder, native multimodal",
        "Tracked family: Gemini / Gemma",
        "Primary record: VLM Survey Report"
      ],
      "discovered_at": "2026-04-13T00:00:00+00:00",
      "raw_payload_hash": "sha256:c03c10e582d1b1d292406da7219ef067bc1746746ba62ed1c10a6ade5d1c4241"
    },
    {
      "source": "VLM Survey Report",
      "source_id": "report/2026-04-13:internvl-u:https-arxiv-org-abs-2603-09877",
      "title": "InternVL-U",
      "url": "https://arxiv.org/abs/2603.09877",
      "event_kind": "curated",
      "provenance": "curated",
      "categories": [
        "vlm_model"
      ],
      "relevance_score": 49.0,
      "evidence_score": 52.0,
      "recency_score": 0.0,
      "adoption_score": 0.0,
      "total_score": 30.06,
      "score_version": 1,
      "published_at": "2026-03-10T00:00:00+00:00",
      "summary": "Architecture: Unified (MLLM + MMDiT gen head). Training Data: Multimodal understanding + generation data. Parameters: 4B. Vision Encoder: InternViT. Pretrained Backbone: InternVL",
      "organizations": [
        "Shanghai AI Lab"
      ],
      "facets": {
        "survey_section": "1. New SoTA VLMs",
        "survey_origin": "report/2026-04-13",
        "columns": {
          "Model": "InternVL-U (Shanghai AI Lab)",
          "Date": "03/10/2026",
          "Architecture": "Unified (MLLM + MMDiT gen head)",
          "Training Data": "Multimodal understanding + generation data",
          "Parameters": "4B",
          "Vision Encoder": "InternViT",
          "Pretrained Backbone": "InternVL"
        },
        "report_date": "2026-04-13"
      },
      "section": "1. New SoTA VLMs",
      "matched_terms": [
        "vlm",
        "mllm",
        "vision encoder"
      ],
      "model_families": [
        "InternVL"
      ],
      "rationale": [
        "Topics: VLM releases",
        "Matched: vlm, mllm, vision encoder",
        "Tracked family: InternVL",
        "Primary record: VLM Survey Report"
      ],
      "discovered_at": "2026-04-13T00:00:00+00:00",
      "raw_payload_hash": "sha256:56d20718e37d1bb6dc4e930450ba46ca7255e6914a2f35630022b3b424fee37c"
    },
    {
      "source": "VLM Survey Report",
      "source_id": "report/2026-04-13:glm-4-6v:https-z-ai-blog-glm-4-6v",
      "title": "GLM-4.6V",
      "url": "https://z.ai/blog/glm-4.6v",
      "event_kind": "curated",
      "provenance": "curated",
      "categories": [
        "vlm_model"
      ],
      "relevance_score": 44.0,
      "evidence_score": 52.0,
      "recency_score": 0.0,
      "adoption_score": 0.0,
      "total_score": 28.16,
      "score_version": 1,
      "published_at": "2025-12-01T00:00:00+00:00",
      "summary": "Architecture: Decoder-only. Training Data: Undisclosed. Parameters: 106B / 9B (Flash). Vision Encoder: Undisclosed. Pretrained Backbone: GLM-4.6",
      "organizations": [
        "Zhipu / Z.AI",
        "Zhipu AI"
      ],
      "facets": {
        "survey_section": "1. New SoTA VLMs",
        "survey_origin": "report/2026-04-13",
        "columns": {
          "Model": "GLM-4.6V (Zhipu / Z.AI)",
          "Date": "12/2025",
          "Architecture": "Decoder-only",
          "Training Data": "Undisclosed",
          "Parameters": "106B / 9B (Flash)",
          "Vision Encoder": "Undisclosed",
          "Pretrained Backbone": "GLM-4.6"
        },
        "report_date": "2026-04-13"
      },
      "section": "1. New SoTA VLMs",
      "matched_terms": [